"location","city","country","address","latitude","longitude","co2_kg","distance_km","plane trips_amount","train trips_amount"
"Pasadena,  United States","Pasadena"," United States","Pasadena, California, United States","34.1476452","-118.1444779","0.0","0.0","0","37"
"Glendora,  United States","Glendora"," United States","Glendora, California, United States","34.1361187","-117.865339","1.538","51.443","0","1"
"Rancho Cucamonga,  United States","Rancho Cucamonga"," United States","Rancho Cucamonga, San Bernardino County, California, United States","34.1033192","-117.5751735","6.295","210.539","0","2"
"Los Angeles,  United States","Los Angeles"," United States","Los Angeles, California, United States","34.0536909","-118.242766","9.919","331.727","0","12"
"Irvine,  United States","Irvine"," United States","Irvine, Orange County, California, United States","33.6856969","-117.8259819","10.617","355.078","0","3"
"Riverside,  United States","Riverside"," United States","Riverside, Riverside County, California, United States","33.9533546","-117.3961623","30.243","1011.47","0","7"
"San Diego,  United States","San Diego"," United States","San Diego, San Diego County, California, United States","32.7174202","-117.1627728","99.298","1099.649","3","0"
"Las Vegas,  United States","Las Vegas"," United States","Las Vegas, Clark County, Nevada, United States","36.1672559","-115.148516","197.73","705.943","1","0"
"Santa Cruz County,  United States","Santa Cruz County"," United States","Santa Cruz County, California, United States","37.050096","-121.9905908","244.32","948.692","1","0"
"1,  United States","1"," United States","1, South Bend, Fremont County, Colorado, 81212, United States","38.622348","-105.518825","491.63","2466.925","1","0"
"Mountain View,  United States","Mountain View"," United States","Mountain View, Santa Clara County, California, United States","37.3893889","-122.0832101","511.385","2024.307","2","0"
"Denver,  United States","Denver"," United States","Denver, Denver County, Colorado, United States","39.7392364","-104.9848623","512.382","2645.15","1","0"
"Flagstaff,  United States","Flagstaff"," United States","Flagstaff, Coconino County, Arizona, United States","35.1987522","-111.6518229","586.969","2420.055","2","0"
"University of California,  United States","University of California"," United States","University of California, Berkeley, Derby Street, Claremont, Berkeley, Alameda County, California, 94720-1076, United States","37.8753497","-122.23963364918777","822.437","3326.316","3","0"
"Tempe,  United States","Tempe"," United States","Tempe, Maricopa County, Arizona, United States","33.4255056","-111.9400091","850.519","3473.352","3","0"
"Grand Forks,  United States","Grand Forks"," United States","Grand Forks, Grand Forks County, North Dakota, United States","47.9078244","-97.0592028","853.942","4649.663","1","0"
"Reno,  United States","Reno"," United States","Reno, Washoe County, Nevada, United States","39.5261206","-119.8126581","893.244","3697.051","3","0"
"St. Louis,  United States","St. Louis"," United States","St. Louis, City of Saint Louis, Madison County, Illinois, United States","38.6529545","-90.24111656024635","929.343","5073.572","1","0"
"Mississippi State,  United States","Mississippi State"," United States","Mississippi State, MS Post Office, Herbert Street, College Vista, Oktibbeha County, Mississippi, 39762, United States","33.4549304","-88.7859584","988.985","5408.883","1","0"
"Nashville,  United States","Nashville"," United States","Nashville, Davidson County, Tennessee, United States","36.1622767","-86.7742984","1040.187","5696.744","1","0"
"Atlanta,  United States","Atlanta"," United States","Atlanta, Fulton County, Georgia, United States","33.7489924","-84.3902644","1129.509","6198.918","1","0"
"Ann Arbor,  United States","Ann Arbor"," United States","Ann Arbor, Washtenaw County, Michigan, United States","42.2681569","-83.7312291","1135.258","6231.241","1","0"
"Chapel Hill,  United States","Chapel Hill"," United States","Chapel Hill, Orange County, North Carolina, United States","35.9131542","-79.05578","1222.466","7081.536","1","0"
"Alachua County,  United States","Alachua County"," United States","Alachua County, Florida, United States","29.675568","-82.3640109","1222.762","6792.552","1","0"
"State College,  United States","State College"," United States","State College, Centre County, Pennsylvania, United States","40.7944504","-77.8616386","1231.158","7196.52","1","0"
"Rochester,  United States","Rochester"," United States","Rochester, Monroe, New York, United States","43.157285","-77.615214","1234.544","7241.319","1","0"
"Toronto,  Canada","Toronto"," Canada","Toronto, Golden Horseshoe, Ontario, Canada","43.6534817","-79.3839347","1236.322","6962.317","1","0"
"Washington,  United States","Washington"," United States","Washington, District of Columbia, United States","38.8949924","-77.0365581","1243.496","7359.746","1","0"
"Philadelphia,  United States","Philadelphia"," United States","Philadelphia, Philadelphia County, Pennsylvania, United States","39.9527237","-75.1635262","1270.056","7662.178","1","0"
"Tucson,  United States","Tucson"," United States","Tucson, Pima County, Arizona, United States","32.2228765","-110.9748477","1319.83","5603.986","4","0"
"Honolulu,  United States","Honolulu"," United States","Honolulu, Honolulu County, Hawaii, United States","21.304547","-157.855676","1366.707","8261.221","1","0"
"Mexico City,  Mexico","Mexico City"," Mexico","Mexico City, Mexico","19.4326296","-99.1331785","1824.934","9957.386","2","0"
"Columbus,  United States","Columbus"," United States","Columbus, Franklin County, Ohio, United States","39.9622601","-83.0007065","2304.669","12654.485","2","0"
"University of Maryland,  United States","University of Maryland"," United States","University of Maryland, College Park, University Boulevard East, Berwyn, College Park, Prince George's County, Maryland, 20740, United States","38.99203005","-76.94610290199051","2489.082","14747.131","2","0"
"New Brunswick,  United States","New Brunswick"," United States","New Brunswick, Middlesex County, New Jersey, United States","40.4862174","-74.4518173","2576.328","15548.823","2","0"
"New Haven,  United States","New Haven"," United States","New Haven, New Haven County, Connecticut, United States","41.298434349999994","-72.93102342707913","2654.877","16035.672","2","0"
"Warwick,  United Kingdom","Warwick"," United Kingdom","Warwick, Warwickshire, West Midlands, England, United Kingdom","52.2814519","-1.5815742","2812.12","17219.916","1","0"
"Oxford,  United Kingdom","Oxford"," United Kingdom","Oxford, Oxfordshire, South East England, England, United Kingdom","51.7520131","-1.2578499","2829.949","17330.425","1","0"
"London,  United Kingdom","London"," United Kingdom","London, Greater London, England, United Kingdom","51.5073219","-0.1276474","2854.637","17483.438","1","0"
"Stockholm,  Sweden","Stockholm"," Sweden","Stockholm, Stockholms kommun, Stockholm County, 111 29, Sweden","59.3251172","18.0710935","2895.268","17735.27","1","0"
"Liège,  Belgium","Liège"," Belgium","Liège, Wallonia, 4000, Belgium","50.6451381","5.5734203","2968.688","18190.33","1","0"
"Bordeaux,  France","Bordeaux"," France","Bordeaux, New Aquitaine, Metropolitan France, France","44.841225","-0.5800364","3006.964","18427.561","1","0"
"Canary Islands,  Spain","Canary Islands"," Spain","Canary Islands, Spain","28.2935785","-16.621447121144122","3014.788","18476.057","1","0"
"Seoul,  South Korea","Seoul"," South Korea","Seoul, Nowon-gu, South Korea","37.5666791","126.9782914","3126.754","19170.022","1","0"
"Daegu,  South Korea","Daegu"," South Korea","Daegu, South Korea","35.8713","128.6018","3131.126","19197.12","1","0"
"Turin,  Italy","Turin"," Italy","Turin, Torino, Piemont, Italy","45.0677551","7.6824892","3149.453","19310.711","1","0"
"Milan,  Italy","Milan"," Italy","Milan, Lombardy, Italy","45.4668","9.1905","3164.107","19401.536","1","0"
"Rua 1o de Janiero,  Brazil","Rua 1o de Janiero"," Brazil","Rua 1o de Janiero, Jardim Gramacho, Duque de Caxias, Região Geográfica Imediata do Rio de Janeiro, Região Metropolitana do Rio de Janeiro, Região Geográfica Intermediária do Rio de Janeiro, Rio de Janeiro, Southeast Region, 25056-250, Brazil","-22.7645391","-43.2753637","3300.125","20244.582","1","0"
"Greenbelt,  United States","Greenbelt"," United States","Greenbelt, Good Luck Road, New Carrollton, Prince George's County, Maryland, 20706, United States","38.9937333","-76.883065797021","3736.078","22153.182","3","0"
"Seattle,  United States","Seattle"," United States","Seattle, King County, Washington, United States","47.6038321","-122.3300624","4613.806","24583.653","8","0"
"New York,  United States","New York"," United States","New York, United States","40.7127281","-74.0060152","5198.969","31384.693","4","0"
"Cambridge,  United States","Cambridge"," United States","Cambridge, Middlesex County, Massachusetts, United States","42.3750997","-71.1056157","5495.373","33221.809","4","0"
"Chicago,  United States","Chicago"," United States","Chicago, Cook County, Illinois, United States","41.8755616","-87.6244212","6119.552","33496.979","6","0"
"Bern,  Switzerland","Bern"," Switzerland","Bern, Bern-Mittelland administrative district, Bernese Mittelland administrative region, Bern, Switzerland","46.9482713","7.4514512","6191.405","37955.136","2","0"