"location","city","country","address","latitude","longitude","co2_kg","distance_km","plane trips_amount","train trips_amount"
"Lisbon,  Portugal","Lisbon"," Portugal","Lisbon, Grande Lisboa, Área Metropolitana de Lisboa, Portugal","38.7077507","-9.1365919","0.0","0.0","0","3"
"Toulouse,  France","Toulouse"," France","Toulouse, Haute-Garonne, Occitania, Metropolitan France, France","43.6044622","1.4442469","446.244","2077.15","1","0"
"Marseille,  France","Marseille"," France","Marseille, Bouches-du-Rhône, Provence-Alpes-Côte d'Azur, Metropolitan France, 13000, France","43.2961743","5.3699525","511.24","2635.342","1","0"
"Grenoble,  France","Grenoble"," France","Grenoble, Isère, Auvergne-Rhône-Alpes, Metropolitan France, France","45.1875602","5.7357819","537.196","2844.407","1","0"
"Paris,  France","Paris"," France","Paris, Ile-de-France, Metropolitan France, France","48.8566969","2.3514616","547.77","2908.178","1","0"
"Geneva,  Switzerland","Geneva"," Switzerland","Geneva, Grand Genève, Geneva, Switzerland","46.2017559","6.1466014","564.418","3002.919","1","0"
"Leiden,  Netherlands","Leiden"," Netherlands","Leiden, Zoeterwoude, South Holland, Netherlands","52.1518157","4.4811088666204295","679.033","3655.153","1","0"
"Teramo,  Italy","Teramo"," Italy","Teramo, Abruzzo, Italy","42.65811795","13.69787458752063","728.528","3936.808","1","0"
"Potsdam,  Germany","Potsdam"," Germany","Potsdam, Brandenburg, Germany","52.4009309","13.0591397","840.261","4572.643","1","0"
"Warsaw,  Poland","Warsaw"," Poland","Warsaw, Masovian Voivodeship, Poland","52.2319581","21.0067249","1008.647","5519.422","1","0"
"Cairo,  Egypt","Cairo"," Egypt","Cairo, Cairo Governorate, Egypt","30.0443879","31.2357257","1260.992","7591.196","1","0"
"Heidelberg,  Germany","Heidelberg"," Germany","Heidelberg, Baden-Württemberg, Germany","49.4093582","8.694724","1372.553","7392.744","2","0"
"County Durham,  United Kingdom","County Durham"," United Kingdom","County Durham, North East England, England, United Kingdom","54.666667","-1.75","1380.41","7437.457","2","0"
"São Paulo,  Brazil","São Paulo"," Brazil","São Paulo, Região Imediata de São Paulo, Região Metropolitana de São Paulo, Região Geográfica Intermediária de São Paulo, São Paulo, Southeast Region, 01001-000, Brazil","-23.5506507","-46.6333824","2598.483","15895.79","1","0"
"Pune,  India","Pune"," India","Pune, Pune District, Maharashtra, India","18.521428","73.8544541","2660.508","16280.223","1","0"