"location","city","country","address","latitude","longitude","co2_kg","distance_km","plane trips_amount","train trips_amount"
"Oxford,  United Kingdom","Oxford"," United Kingdom","Oxford, Oxfordshire, South East England, England, United Kingdom","51.7520131","-1.2578499","0.0","0.0","0","16"
"Cambridge,  United Kingdom","Cambridge"," United Kingdom","Cambridge, Cambridgeshire, East of England, England, United Kingdom","52.197584649999996","0.13915373736874398","6.444","215.508","0","1"
"Warwick,  United Kingdom","Warwick"," United Kingdom","Warwick, Warwickshire, West Midlands, England, United Kingdom","52.2814519","-1.5815742","11.284","377.406","0","3"
"Leicester,  United Kingdom","Leicester"," United Kingdom","Leicester, Leicestershire, East Midlands, England, LE1 5YA, United Kingdom","52.6361398","-1.1330789","11.802","394.711","0","2"
"Norwich,  United Kingdom","Norwich"," United Kingdom","Norwich, Norfolk, East of England, England, United Kingdom","52.628606","1.29227","11.917","398.561","0","1"
"London,  United Kingdom","London"," United Kingdom","London, Greater London, England, United Kingdom","51.5073219","-0.1276474","14.822","495.709","0","3"
"Exeter,  United Kingdom","Exeter"," United Kingdom","Exeter, Devon, South West England, England, United Kingdom","50.725562","-3.5269108","46.613","1558.955","0","4"
"Dublin,  Ireland","Dublin"," Ireland","Dublin, Dublin 1, Leinster, Ireland","53.3497645","-6.2602732","208.846","763.862","1","0"
"Leuven,  Belgium","Leuven"," Belgium","Leuven, Flemish Brabant, Flanders, Belgium","50.879202","4.7011675","225.471","850.48","1","0"
"Utrecht,  Netherlands","Utrecht"," Netherlands","Utrecht, Netherlands","52.0949753","5.109708","230.437","876.356","1","0"
"Bern,  Switzerland","Bern"," Switzerland","Bern, Bern-Mittelland administrative district, Bernese Mittelland administrative region, Bern, Switzerland","46.9482713","7.4514512","377.762","1651.293","1","0"
"Rostock,  Germany","Rostock"," Germany","Rostock, Mecklenburg-Vorpommern, Germany","54.0924445","12.1286127","418.68","1865.536","1","0"
"Turin,  Italy","Turin"," Italy","Turin, Torino, Piemont, Italy","45.0677551","7.6824892","435.511","1984.965","1","0"
"Berlin,  Germany","Berlin"," Germany","Berlin, 10117, Germany","52.5170365","13.3888599","437.622","2003.103","1","0"
"Belfast,  United Kingdom","Belfast"," United Kingdom","Belfast, County Antrim, Northern Ireland, BT1 5GS, United Kingdom","54.5964411","-5.9302761","465.099","1774.723","2","0"
"St Andrews,  United Kingdom","St Andrews"," United Kingdom","St Andrews, Fife, Scotland, KY16 9PA, United Kingdom","56.3403902","-2.7955844","521.986","2079.813","2","0"
"Leiden,  Netherlands","Leiden"," Netherlands","Leiden, Zoeterwoude, South Holland, Netherlands","52.1518157","4.4811088666204295","642.396","2374.206","3","0"
"Paris,  France","Paris"," France","Paris, Ile-de-France, Metropolitan France, France","48.8566969","2.3514616","660.503","2468.546","3","0"
"Bordeaux,  France","Bordeaux"," France","Bordeaux, New Aquitaine, Metropolitan France, France","44.841225","-0.5800364","713.065","3080.281","2","0"
"Geneva,  Switzerland","Geneva"," Switzerland","Geneva, Grand Genève, Geneva, Switzerland","46.2017559","6.1466014","750.821","3277.963","2","0"
"San Cristóbal de La Laguna,  Spain","San Cristóbal de La Laguna"," Spain","San Cristóbal de La Laguna, Santa Cruz de Tenerife, Canary Islands, Spain","28.4857715","-16.3159422","1049.147","5747.115","1","0"
"Providence,  United States","Providence"," United States","Providence, Providence County, Rhode Island, United States","41.8239891","-71.4128343","1724.971","10481.748","1","0"
"Amsterdam,  Netherlands","Amsterdam"," Netherlands","Amsterdam, North Holland, Netherlands","52.3727598","4.8936041","1806.171","6816.372","8","0"
"Princeton,  United States","Princeton"," United States","Princeton, Mercer County, New Jersey, United States","40.3492744","-74.6592958","1826.655","11111.987","1","0"
"State College,  United States","State College"," United States","State College, Centre County, Pennsylvania, United States","40.7944504","-77.8616386","1883.876","11466.646","1","0"
"London,  Canada","London"," Canada","London, Southwestern Ontario, Ontario, N6A 1G4, Canada","42.9836747","-81.2496068","1903.593","11588.85","1","0"
"Greenbelt,  United States","Greenbelt"," United States","Greenbelt, Good Luck Road, New Carrollton, Prince George's County, Maryland, 20706, United States","38.9937333","-76.883065797021","1904.965","11597.358","1","0"
"University of Maryland,  United States","University of Maryland"," United States","University of Maryland, College Park, University Boulevard East, Berwyn, College Park, Prince George's County, Maryland, 20740, United States","38.99203005","-76.94610290199051","1906.34","11605.878","1","0"
"Hampton,  United States","Hampton"," United States","Hampton, Virginia, United States","37.0300969","-76.3452057","1939.815","11813.356","1","0"
"Tallahassee,  United States","Tallahassee"," United States","Tallahassee, Leon County, Florida, United States","30.4380832","-84.2809332","2274.193","13885.834","1","0"
"Boulder,  United States","Boulder"," United States","Boulder, Boulder County, Colorado, United States","40.0149856","-105.270545","2439.12","14908.055","1","0"
"Seattle,  United States","Seattle"," United States","Seattle, King County, Washington, United States","47.6038321","-122.3300624","2495.992","15260.553","1","0"
"Austin,  United States","Austin"," United States","Austin, Travis County, Texas, United States","30.2711286","-97.7436995","2559.755","15655.752","1","0"
"Tempe,  United States","Tempe"," United States","Tempe, Maricopa County, Arizona, United States","33.4255056","-111.9400091","2743.372","16793.817","1","0"
"Mountain View,  United States","Mountain View"," United States","Mountain View, Santa Clara County, California, United States","37.3893889","-122.0832101","2796.891","17125.531","1","0"
"Stanford,  United States","Stanford"," United States","Stanford, Palo Alto, Santa Clara County, California, United States","37.426540700000004","-122.17029258409187","2797.128","17126.994","1","0"
"Riverside,  United States","Riverside"," United States","Riverside, Riverside County, California, United States","33.9533546","-117.3961623","2823.086","17287.888","1","0"
"Irvine,  United States","Irvine"," United States","Irvine, Orange County, California, United States","33.6856969","-117.8259819","2838.263","17381.955","1","0"
"Santa Barbara,  United States","Santa Barbara"," United States","Santa Barbara, Santa Barbara County, California, United States","34.4221319","-119.7026673","2847.668","17440.242","1","0"
"Boston,  United States","Boston"," United States","Boston, Suffolk County, Massachusetts, United States","42.3602534","-71.0582912","3411.654","20726.185","2","0"
"Ithaca,  United States","Ithaca"," United States","Ithaca, Ithaca Town, Tompkins County, New York, United States","42.4396039","-76.4968019","3636.524","22119.934","2","0"
"Abu Dhabi,  United Arab Emirates","Abu Dhabi"," United Arab Emirates","Abu Dhabi, Al Mushrif, Abu Dhabi, Abu Dhabi Emirate, 36668, United Arab Emirates","24.4538352","54.3774014","3653.575","22225.621","2","0"
"Toronto,  Canada","Toronto"," Canada","Toronto, Golden Horseshoe, Ontario, Canada","43.6534817","-79.3839347","3701.205","22520.829","2","0"
"Manoa,  United States","Manoa"," United States","Manoa, Honolulu, Honolulu County, Hawaii, 96848, United States","21.3093848","-157.8118169","3769.262","23152.304","1","0"
"Ann Arbor,  United States","Ann Arbor"," United States","Ann Arbor, Washtenaw County, Michigan, United States","42.2681569","-83.7312291","3940.54","24004.235","2","0"
"Victoria,  Canada","Victoria"," Canada","Victoria, Capital Regional District, British Columbia, Canada","48.4283182","-123.3649533","4971.402","30393.535","2","0"
"Beijing,  China","Beijing"," China","Beijing, Dongcheng District, Beijing, 100010, China","39.906217","116.3912757","5344.568","32706.422","2","0"
"Flagstaff,  United States","Flagstaff"," United States","Flagstaff, Coconino County, Arizona, United States","35.1987522","-111.6518229","5374.769","32893.611","2","0"
"Canberra,  Australia","Canberra"," Australia","Canberra, District of Canberra Central, Australian Capital Territory, 2601, Australia","-35.2975906","149.1012676","5532.336","34079.862","1","0"
"Los Angeles,  United States","Los Angeles"," United States","Los Angeles, California, United States","34.0536909","-118.242766","5668.761","34715.777","2","0"
"Orlando,  United States","Orlando"," United States","Orlando, Orange County, Florida, United States","28.5421109","-81.3790304","6781.819","41404.876","3","0"
"Tucson,  United States","Tucson"," United States","Tucson, Pima County, Arizona, United States","32.2228765","-110.9748477","8281.405","50699.338","3","0"
"Pasadena,  United States","Pasadena"," United States","Pasadena, California, United States","34.1476452","-118.1444779","8489.848","51991.275","3","0"
"Tokyo,  Japan","Tokyo"," Japan","Tokyo, Japan","35.6828387","139.7594549","9374.483","57474.256","3","0"
"Baltimore,  United States","Baltimore"," United States","Baltimore, Maryland, United States","39.2908816","-76.610759","9461.405","57593.695","5","0"
"Montreal,  Canada","Montreal"," Canada","Montreal, Urban agglomeration of Montreal, Montreal (06), Quebec, Canada","45.5031824","-73.5698065","10152.482","61667.351","6","0"
"Chicago,  United States","Chicago"," United States","Chicago, Cook County, Illinois, United States","41.8755616","-87.6244212","10286.964","62710.524","5","0"
"Cambridge,  United States","Cambridge"," United States","Cambridge, Middlesex County, Massachusetts, United States","42.3750997","-71.1056157","11945.571","72571.294","7","0"
"Santa Cruz County,  United States","Santa Cruz County"," United States","Santa Cruz County, California, United States","37.050096","-121.9905908","19639.552","120258.729","7","0"