"location","city","country","address","latitude","longitude","co2_kg","distance_km","plane trips_amount","train trips_amount"
"Noordwijk,  Netherlands","Noordwijk"," Netherlands","Noordwijk, South Holland, Netherlands","52.2410856","4.4461969","0.0","0.0","0","8"
"Amsterdam,  Netherlands","Amsterdam"," Netherlands","Amsterdam, North Holland, Netherlands","52.3727598","4.8936041","2.019","67.517","0","1"
"Leiden,  Netherlands","Leiden"," Netherlands","Leiden, Zoeterwoude, South Holland, Netherlands","52.1518157","4.4811088666204295","7.325","244.982","0","12"
"Brussels,  Belgium","Brussels"," Belgium","Brussels, City of Brussels, Brussels-Capital, Belgium","50.8465573","4.351697","9.281","310.405","0","1"
"Uccle - Ukkel,  Belgium","Uccle - Ukkel"," Belgium","Uccle - Ukkel, Brussels-Capital, 1180, Belgium","50.8035441","4.3338445","9.57","320.073","0","1"
"Liège,  Belgium","Liège"," Belgium","Liège, Wallonia, 4000, Belgium","50.6451381","5.5734203","11.595","387.782","0","1"
"Leuven,  Belgium","Leuven"," Belgium","Leuven, Flemish Brabant, Flanders, Belgium","50.879202","4.7011675","18.234","609.827","0","2"
"Cambridge,  United Kingdom","Cambridge"," United Kingdom","Cambridge, Cambridgeshire, East of England, England, United Kingdom","52.197584649999996","0.13915373736874398","35.091","1173.615","0","2"
"Groningen,  Netherlands","Groningen"," Netherlands","Groningen, Netherlands","53.2190652","6.5680077","42.946","1436.32","0","4"
"London,  United Kingdom","London"," United Kingdom","London, Greater London, England, United Kingdom","51.5073219","-0.1276474","186.749","648.726","1","0"
"Göttingen,  Germany","Göttingen"," Germany","Göttingen, Landkreis Göttingen, Lower Saxony, Germany","51.5328328","9.9351811","209.932","769.518","1","0"
"Warwick,  United Kingdom","Warwick"," United Kingdom","Warwick, Warwickshire, West Midlands, England, United Kingdom","52.2814519","-1.5815742","219.677","820.292","1","0"
"Sheffield,  United Kingdom","Sheffield"," United Kingdom","Sheffield, Yorkshire and the Humber, England, United Kingdom","53.3806626","-1.4702278","222.388","834.417","1","0"
"Southampton,  United Kingdom","Southampton"," United Kingdom","Southampton, South East England, England, United Kingdom","50.9025349","-1.404189","227.568","861.406","1","0"
"Birmingham,  United Kingdom","Birmingham"," United Kingdom","Birmingham, West Midlands Combined Authority, West Midlands, England, United Kingdom","52.4796992","-1.9026911","227.99","863.607","1","0"
"Keele,  United Kingdom","Keele"," United Kingdom","Keele, Newcastle-under-Lyme, Staffordshire, West Midlands, England, United Kingdom","53.0038078","-2.2877425","239.666","924.44","1","0"
"Besançon,  France","Besançon"," France","Besançon, Doubs, Bourgogne-Franche-Comté, Metropolitan France, 25000, France","47.2380222","6.0243622","279.239","1135.441","1","0"
"Lund,  Sweden","Lund"," Sweden","Lund, Lund Municipality, Skåne County, Sweden","55.7029296","13.1929449","325.464","1377.467","1","0"
"Prague,  Czechia","Prague"," Czechia","Prague, Czechia","50.0596288","14.446459273258009","344.192","1475.527","1","0"
"Poznań,  Poland","Poznań"," Poland","Poznań, Poznań County, Greater Poland Voivodeship, Poland","52.4006632","16.91973259178088","385.888","1693.839","1","0"
"Padua,  Italy","Padua"," Italy","Padua, Padova, Veneto, Italy","45.4077172","11.8734455","418.88","1866.584","1","0"
"Oxford,  United Kingdom","Oxford"," United Kingdom","Oxford, Oxfordshire, South East England, England, United Kingdom","51.7520131","-1.2578499","427.099","1576.732","2","0"
"Osservatorio astrofisico di Arcetri,  Italy","Osservatorio astrofisico di Arcetri"," Italy","Osservatorio astrofisico di Arcetri, Via Guglielmo Righini, Pian dei Giullari, Quartiere 3, Florence, Metropolitan City of Florence, Tuscany, 50125, Italy","43.75018505","11.254173557851482","453.646","2140.713","1","0"
"Leeds,  United Kingdom","Leeds"," United Kingdom","Leeds, West Yorkshire, Yorkshire and the Humber, England, United Kingdom","53.7974185","-1.5437941","459.404","1745.052","2","0"
"Warsaw,  Poland","Warsaw"," Poland","Warsaw, Masovian Voivodeship, Poland","52.2319581","21.0067249","466.43","2250.501","1","0"
"Stockholm,  Sweden","Stockholm"," Sweden","Stockholm, Stockholms kommun, Stockholm County, 111 29, Sweden","59.3251172","18.0710935","473.66","2312.598","1","0"
"Budapest,  Hungary","Budapest"," Hungary","Budapest, V. kerület, Central Hungary, Hungary","47.4983815","19.0404707","476.502","2337.004","1","0"
"Capodimonte,  Italy","Capodimonte"," Italy","Capodimonte, Viterbo, Lazio, Italy","42.546527","11.904755","487.079","2427.84","1","0"
"A Coruña,  Spain","A Coruña"," Spain","A Coruña, Galicia, Spain","43.3712091","-8.3958768","524.502","2743.678","1","0"
"Vilnius,  Lithuania","Vilnius"," Lithuania","Vilnius, Vilnius city municipality, Vilnius County, Lithuania","54.6870458","25.2829111","531.701","2800.799","1","0"
"Naples,  Italy","Naples"," Italy","Naples, Napoli, Campania, Italy","40.8359336","14.2487826","553.456","2940.535","1","0"
"Helsinki,  Finland","Helsinki"," Finland","Helsinki, Helsinki sub-region, Uusimaa, Southern Finland, Mainland Finland, Finland","60.1674881","24.9427473","575.771","3067.524","1","0"
"Porto,  Portugal","Porto"," Portugal","Porto, North, Portugal","41.1494512","-8.6107884","592.076","3160.312","1","0"
"Garching bei München,  Germany","Garching bei München"," Germany","Garching bei München, Landkreis München, Bavaria, 85748, Germany","48.2513878","11.6509662","642.066","2708.536","2","0"
"Catania,  Italy","Catania"," Italy","Catania, Sicily, Italy","37.5022355","15.08738","682.161","3672.954","1","0"
"Strasbourg,  France","Strasbourg"," France","Strasbourg, Bas-Rhin, Grand Est, Metropolitan France, France","48.584614","7.7507127","726.887","2814.429","3","0"
"Potsdam,  Germany","Potsdam"," Germany","Potsdam, Brandenburg, Germany","52.4009309","13.0591397","857.88","3511.891","3","0"
"Bologna,  Italy","Bologna"," Italy","Bologna, Emilia-Romagna, Italy","44.4937577","11.3430308","874.435","3999.248","2","0"
"Dresden,  Germany","Dresden"," Germany","Dresden, Saxony, Germany","51.0493286","13.7381437","936.824","3925.232","3","0"
"Geneva,  Switzerland","Geneva"," Switzerland","Geneva, Grand Genève, Geneva, Switzerland","46.2017559","6.1466014","969.536","4096.51","3","0"
"Rome,  Italy","Rome"," Italy","Rome, Roma Capitale, Lazio, Italy","41.8933203","12.4829321","1014.18","5199.397","2","0"
"Heidelberg,  Germany","Heidelberg"," Germany","Heidelberg, Baden-Württemberg, Germany","49.4093582","8.694724","1143.545","4336.763","5","0"
"Vienna,  Austria","Vienna"," Austria","Vienna, Austria","48.2083537","16.3725042","1282.458","5748.147","3","0"
"Paris,  France","Paris"," France","Paris, Ile-de-France, Metropolitan France, France","48.8566969","2.3514616","1304.691","4852.092","6","0"
"Ljubljana,  Slovenia","Ljubljana"," Slovenia","Ljubljana, Upravna Enota Ljubljana, 1000, Slovenia","46.0499803","14.5068602","1313.887","6018.066","3","0"
"Kyiv,  Ukraine","Kyiv"," Ukraine","Kyiv, Ukraine","50.4500336","30.5241361","1347.259","7248.803","2","0"
"Turin,  Italy","Turin"," Italy","Turin, Torino, Piemont, Italy","45.0677551","7.6824892","1520.89","6656.71","4","0"
"Nice,  France","Nice"," France","Nice, Maritime Alps, Provence-Alpes-Côte d'Azur, Metropolitan France, France","43.7009358","7.2683912","1723.323","7779.096","4","0"
"Cambridge,  United States","Cambridge"," United States","Cambridge, Middlesex County, Massachusetts, United States","42.3750997","-71.1056157","1820.005","11070.77","1","0"
"Ankara,  Turkey","Ankara"," Turkey","Ankara, Çankaya, Ankara, Central Anatolia Region, 06420, Turkey","39.9207893","32.8540412","1874.404","10235.507","2","0"
"New York,  United States","New York"," United States","New York, United States","40.7127281","-74.0060152","1918.005","11678.175","1","0"
"Toronto,  Canada","Toronto"," Canada","Toronto, Golden Horseshoe, Ontario, Canada","43.6534817","-79.3839347","1957.189","11921.038","1","0"
"Washington,  United States","Washington"," United States","Washington, District of Columbia, United States","38.8949924","-77.0365581","2023.743","12333.54","1","0"
"Bordeaux,  France","Bordeaux"," France","Bordeaux, Gironde, New Aquitaine, Metropolitan France, France","44.841225","-0.5800364","2033.994","9016.64","5","0"
"Charlottesville,  United States","Charlottesville"," United States","Charlottesville, Virginia, United States","38.029306","-78.4766781","2074.509","12648.194","1","0"
"San Cristóbal de La Laguna,  Spain","San Cristóbal de La Laguna"," Spain","San Cristóbal de La Laguna, Santa Cruz de Tenerife, Canary Islands, Spain","28.4857715","-16.3159422","2294.191","12595.579","2","0"
"San Antonio,  United States","San Antonio"," United States","San Antonio, Bexar County, Texas, United States","29.4246002","-98.4951405","2703.284","16545.352","1","0"
"Madrid,  Spain","Madrid"," Spain","Madrid, Área metropolitana de Madrid y Corredor del Henares, Community of Madrid, 28001, Spain","40.4167047","-3.7035825","3286.333","17447.439","6","0"
"Shanghai,  China","Shanghai"," China","Shanghai, Huangpu District, Shanghai, 200001, China","31.2322758","121.4692071","5815.32","35624.153","2","0"
"Barcelona,  Spain","Barcelona"," Spain","Barcelona, Barcelonès, Barcelona, Catalonia, 08001, Spain","41.3828939","2.1774322","5860.533","29267.944","12","0"
"Beijing,  China","Beijing"," China","Beijing, Dongcheng District, Beijing, 100010, China","39.906217","116.3912757","7704.395","47123.02","3","0"