"location","city","country","address","latitude","longitude","co2_kg","distance_km","plane trips_amount","train trips_amount"
"Yerevan,  Armenia","Yerevan"," Armenia","Yerevan, Armenia","40.1776121","44.5125849","0.0","0.0","0","3"
"Tbilisi,  Georgia","Tbilisi"," Georgia","Tbilisi, Georgia","41.6934591","44.8014495","10.183","340.584","0","1"
"Athens,  Greece","Athens"," Greece","Athens, Municipality of Athens, Regional Unit of Central Athens, Attica, 10667, Greece","37.9839412","23.7283052","671.555","3612.596","1","0"
"Krakow,  Poland","Krakow"," Poland","Krakow, Wieliczka County, Lesser Poland Voivodeship, Poland","50.0469432","19.997153435836697","809.919","4399.979","1","0"
"Triest,  Italy","Triest"," Italy","Triest, UTI Giuliana / Julijska MTU, Friuli-Venezia Giulia, Italy","45.6504806","13.7931263","936.755","5115.243","1","0"
"Berlin,  Germany","Berlin"," Germany","Berlin, 10117, Germany","52.5170365","13.3888599","995.985","5448.239","1","0"
"Munich,  Germany","Munich"," Germany","Munich, Bavaria, Germany","48.1371079","11.5753822","1004.484","5496.018","1","0"
"Innsbruck,  Austria","Innsbruck"," Austria","Innsbruck, Tyrol, Austria","47.2654296","11.3927685","1006.058","5504.869","1","0"
"Bochum,  Germany","Bochum"," Germany","Bochum, North Rhine-Westphalia, Germany","51.4818111","7.2196635","1132.702","6216.866","1","0"
"Paris,  France","Paris"," France","Paris, Ile-de-France, Metropolitan France, France","48.8566969","2.3514616","1228.273","6861.545","1","0"
"Dublin,  Ireland","Dublin"," Ireland","Dublin, Dublin 1, Leinster, Ireland","53.3497645","-6.2602732","1335.939","8070.524","1","0"
"Garching bei München,  Germany","Garching bei München"," Germany","Garching bei München, Landkreis München, Bavaria, 85748, Germany","48.2513878","11.6509662","2006.05","10975.629","2","0"
"Nanjing,  China","Nanjing"," China","Nanjing, Nanjing City, Jiangsu, 210008, China","32.0609736","118.7916458","2143.899","13078.272","1","0"
"Moscow,  Russia","Moscow"," Russia","Moscow, Central Federal District, Russia","55.7504461","37.6174943","2682.925","14431.636","4","0"
"New Haven,  United States","New Haven"," United States","New Haven, New Haven County, Connecticut, United States","41.298434349999994","-72.93102342707913","2930.162","17951.543","1","0"
"Rome,  Italy","Rome"," Italy","Rome, Roma Capitale, Lazio, Italy","41.8933203","12.4829321","2938.345","16065.799","3","0"
"Madison,  United States","Madison"," United States","Madison, Dane County, Wisconsin, 53703, United States","43.074761","-89.3837613","3152.766","19331.246","1","0"
"West Lafayette,  United States","West Lafayette"," United States","West Lafayette, Tippecanoe County, Indiana, United States","40.4258686","-86.9080655","3194.081","19587.319","1","0"
"San Francisco,  United States","San Francisco"," United States","San Francisco, California, United States","37.7790262","-122.419906","3662.41","22490.033","1","0"
"Barcelona,  Spain","Barcelona"," Spain","Barcelona, Barcelonès, Barcelona, Catalonia, 08001, Spain","41.3828939","2.1774322","3663.113","21187.924","3","0"
"Stanford,  United States","Stanford"," United States","Stanford, Palo Alto, Santa Clara County, California, United States","37.426540700000004","-122.17029258409187","3673.595","22559.353","1","0"
"São Paulo,  Brazil","São Paulo"," Brazil","São Paulo, Região Imediata de São Paulo, Região Metropolitana de São Paulo, Região Geográfica Intermediária de São Paulo, São Paulo, Southeast Region, Brazil","-23.5506507","-46.6333824","3828.967","23522.354","1","0"
"Canberra,  Australia","Canberra"," Australia","Canberra, District of Canberra Central, Australian Capital Territory, 2601, Australia","-35.2975906","149.1012676","4411.136","27130.65","1","0"
"Tokyo,  Japan","Tokyo"," Japan","Tokyo, Japan","35.6828387","139.7594549","5188.799","31740.961","2","0"
"Heidelberg,  Germany","Heidelberg"," Germany","Heidelberg, Baden-Württemberg, Germany","49.4093582","8.694724","13017.37","71369.431","12","0"