location,city,country,address,latitude,longitude,co2_kg,distance_km,plane trips_amount,train trips_amount
"Nafplio, Greece",Nafplio,Greece,"Nafplio, Greece",37.5703286566,22.80469909,0,0,0,0
"Athens,  Greece",Athens, Greece,"Athens, Municipality of Athens, Regional Unit of Central Athens, Attica, 10667, Greece",37.9839412,23.7283052,16.697,558.444,0,3
"Beirut,  Lebanon",Beirut, Lebanon,"Beirut, Beirut Governorate, Lebanon",33.8959203,35.47843,486.912,2426.407,1,0
"Bologna,  Italy",Bologna, Italy,"Bologna, Emilia-Romagna, Italy",44.4937577,11.3430308,490.795,2459.753,1,0
"Krakow,  Poland",Krakow, Poland,"Krakow, Wieliczka County, Lesser Poland Voivodeship, Poland",50.0469432,19.9971534358,532.949,2810.706,1,0
"Milan,  Italy",Milan, Italy,"Milan, Lombardy, Italy",45.4668,9.1905,539.562,2861.469,1,0
"Prague,  Czechia",Prague, Czechia,"Prague, Czechia",50.0596288,14.4464592733,577.989,3080.147,1,0
"Marseille,  France",Marseille, France,"Marseille, Bouches-du-Rhône, Provence-Alpes-Côte d'Azur, Metropolitan France, 13000, France",43.2961743,5.3699525,600.252,3206.835,1,0
"Tübingen,  Germany",Tübingen, Germany,"Tübingen, Landkreis Tübingen, Baden-Württemberg, Germany",48.5236164,9.0535531,615.958,3296.213,1,0
"Grenoble,  France",Grenoble, France,"Grenoble, Isère, Auvergne-Rhône-Alpes, Metropolitan France, France",45.1875602,5.7357819,617.425,3304.559,1,0
"Besançon,  France",Besançon, France,"Besançon, Doubs, Bourgogne-Franche-Comté, Metropolitan France, 25000, France",47.2380222,6.0243622,648.784,3483.016,1,0
"Cologne,  Germany",Cologne, Germany,"Cologne, North Rhine-Westphalia, Germany",50.938361,6.959974,719.131,3883.335,1,0
"Palermo,  Italy",Palermo, Italy,"Palermo, Sicily, Italy",38.1112268,13.3524434,760.49,3328.589,2,0
"Lund,  Sweden",Lund, Sweden,"Lund, Lund Municipality, Skåne County, Sweden",55.7029296,13.1929449,789.202,4282.087,1,0
"Noordwijk,  Netherlands",Noordwijk, Netherlands,"Noordwijk, South Holland, Netherlands",52.2410856,4.4461969,798.503,4335.015,1,0
"Madrid,  Spain",Madrid, Spain,"Madrid, Área metropolitana de Madrid y Corredor del Henares, Community of Madrid, 28001, Spain",40.4167047,-3.7035825,846.596,4608.358,1,0
"Hertfordshire,  United Kingdom",Hertfordshire, United Kingdom,"Hertfordshire, East of England, England, United Kingdom",51.8400523,-0.0978551922,876.699,4777.604,1,0
"Cambridge,  United Kingdom",Cambridge, United Kingdom,"Cambridge, Cambridgeshire, East of England, England, United Kingdom",52.19758465,0.1391537374,879.611,4793.974,1,0
"Uppsala,  Sweden",Uppsala, Sweden,"Uppsala, Uppsala kommun, Uppsala County, 753 20, Sweden",59.8586126,17.6387436,918.203,5010.939,1,0
"Exeter,  United Kingdom",Exeter, United Kingdom,"Exeter, Devon, South West England, England, United Kingdom",50.725562,-3.5269108,929.864,5076.496,1,0
"Saint Petersburg,  Russia",Saint Petersburg, Russia,"Saint Petersburg, Northwestern Federal District, 190000, Russia",59.938732,30.316229,931.806,5087.417,1,0
"Cardiff,  United Kingdom",Cardiff, United Kingdom,"Cardiff, Wales, CF, United Kingdom",51.4816546,-3.1791934,935.238,5106.713,1,0
"Sheffield,  United Kingdom",Sheffield, United Kingdom,"Sheffield, Yorkshire and the Humber, England, United Kingdom",53.3806626,-1.4702278,937.594,5119.96,1,0
"Manchester,  United Kingdom",Manchester, United Kingdom,"Manchester, Greater Manchester, North West England, England, United Kingdom",53.4794892,-2.2451148,955.034,5218.005,1,0
"Nizhny Novgorod,  Russia",Nizhny Novgorod, Russia,"Nizhny Novgorod, Nizhny Novgorod Oblast, Volga Federal District, Russia",56.328571,44.003506,955.958,5223.203,1,0
"Oslo,  Norway",Oslo, Norway,"Oslo, Norway",59.9133301,10.7389701,961.715,5255.568,1,0
"Preston,  United Kingdom",Preston, United Kingdom,"Preston, Lancashire, North West England, England, United Kingdom",53.7593363,-2.6992717,969.966,5301.958,1,0
"St Andrews,  United Kingdom",St Andrews, United Kingdom,"St Andrews, Fife, Scotland, KY16 9PA, United Kingdom",56.3403902,-2.7955844,1029.843,5638.588,1,0
"Garching bei München,  Germany",Garching bei München, Germany,"Garching bei München, Landkreis München, Bavaria, 85748, Germany",48.2513878,11.6509662,1122.308,5968.687,2,0
"Nur-Sultan,  Kazakhstan",Nur-Sultan, Kazakhstan,"Nur-Sultan, Kazakhstan",51.1282205,71.4306682,1344.671,8124.645,1,0
"Barcelona,  Spain",Barcelona, Spain,"Barcelona, Barcelonès, Barcelona, Catalonia, 08001, Spain",41.3828939,2.1774322,1349.953,7264.138,2,0
"Bonn,  Germany",Bonn, Germany,"Bonn, North Rhine-Westphalia, Germany",50.735851,7.10066,1422.3,7675.835,2,0
"Tbilisi,  Georgia",Tbilisi, Georgia,"Tbilisi, Georgia",41.6934591,44.8014495,1431.936,7730.67,2,0
"Bengaluru,  India",Bengaluru, India,"Bengaluru, Bangalore North, Bangalore Urban, Karnataka, India",12.9791198,77.5912997,1985.191,12094.6,1,0
"Porto,  Portugal",Porto, Portugal,"Porto, Área Metropolitana do Porto, North, Portugal",41.1494512,-8.6107884,1985.743,10861.461,2,0
"Lisbon,  Portugal",Lisbon, Portugal,"Lisbon, Grande Lisboa, Área Metropolitana de Lisboa, Portugal",38.7077507,-9.1365919,2033.494,11129.923,2,0
"Rome,  Italy",Rome, Italy,"Rome, Roma Capitale, Lazio, Italy",41.8933203,12.4829321,2191.379,10043.571,5,0
"Bordeaux,  France",Bordeaux, France,"Bordeaux, New Aquitaine, Metropolitan France, France",44.841225,-0.5800364,2332.312,12645.411,3,0
"Potchefstroom,  South Africa",Potchefstroom, South Africa,"Potchefstroom, Tlokwe Local Municipality, Potchefstroom, North West, 2520, South Africa",-26.7150922,27.1013887,2344.95,14324.388,1,0
"Quebec City,  Canada",Quebec City, Canada,"Quebec City, Québec (Agglomération), Capitale-Nationale, Quebec, Canada",46.8137431,-71.2084061,2402.322,14679.981,1,0
"London,  Canada",London, Canada,"London, Southwestern Ontario, Ontario, N6A 1G4, Canada",42.9836747,-81.2496068,2690.662,16467.12,1,0
"Hong Kong Island,  China",Hong Kong Island, China,"Hong Kong Island, Hong Kong, China",22.2793278,114.1628131,2820.105,17269.411,1,0
"Leeds,  United Kingdom",Leeds, United Kingdom,"Leeds, West Yorkshire, Yorkshire and the Humber, England, United Kingdom",53.7974185,-1.5437941,2844.674,15539.171,3,0
"Daejeon,  South Korea",Daejeon, South Korea,"Daejeon, South Korea",36.3496,127.3848,2847.624,17439.973,1,0
"Hsinchu,  Taiwan",Hsinchu, Taiwan,"Hsinchu, Taiwan Province, Taiwan",24.8066333,120.9686833,2945.894,18049.049,1,0
"Fukuoka Prefecture,  Japan",Fukuoka Prefecture, Japan,"Fukuoka Prefecture, Japan",33.6251241,130.6180016,2983.109,18279.709,1,0
"Kyushu,  Japan",Kyushu, Japan,"Kyushu, Japan",32.4820755,131.1009051615,3020.81,18513.385,1,0
"São Paulo,  Brazil",São Paulo, Brazil,"São Paulo, Região Imediata de São Paulo, Região Metropolitana de São Paulo, Região Geográfica Intermediária de São Paulo, São Paulo, Southeast Region, Brazil",-23.5506507,-46.6333824,3239.395,19868.175,1,0
"Austin,  United States",Austin, United States,"Austin, Travis County, Texas, United States",30.2711286,-97.7436995,3346.601,20532.641,1,0
"Socorro,  United States",Socorro, United States,"Socorro, Socorro County, New Mexico, United States",34.0572858,-106.8930799,3423.63,21010.066,1,0
"Xinjiang,  China",Xinjiang, China,"Xinjiang, China",42.4804953,85.4633464,3450.078,20964.337,2,0
"Tucson,  United States",Tucson, United States,"Tucson, Pima County, Arizona, United States",32.2228765,-110.9748477,3549.472,21790.041,1,0
"Ensenada,  Mexico",Ensenada, Mexico,"Ensenada, Baja California, Mexico",31.8658887,-116.6029835,3654.626,22441.785,1,0
"Mexico City,  Mexico",Mexico City, Mexico,"Mexico City, Mexico",19.4326296,-99.1331785,3661.519,22484.509,1,0
"Morelia,  Mexico",Morelia, Mexico,"Morelia, Michoacán, 58000, Mexico",19.7027116,-101.1923818,3701.673,22733.382,1,0
"Copenhagen,  Denmark",Copenhagen, Denmark,"Copenhagen, Copenhagen Municipality, Capital Region of Denmark, 1357, Denmark",55.6867243,12.5700724,3971.457,21555.235,5,0
"La Serena,  Chile",La Serena, Chile,"La Serena, Provincia de Elqui, Coquimbo Region, Chile",-29.902631,-71.2520253,4003.944,24606.861,1,0
"Valparaíso,  Chile",Valparaíso, Chile,"Valparaíso, Provincia de Valparaíso, Valparaiso Region, Chile",-33.0458456,-71.6196749,4072.867,25034.053,1,0
"Cambridge,  United States",Cambridge, United States,"Cambridge, Middlesex County, Massachusetts, United States",42.3750997,-71.1056157,4963.523,30344.7,2,0
"Beijing,  China",Beijing, China,"Beijing, 100051, China",39.906217,116.3912757,5042.121,30831.853,2,0
"Charlottesville,  United States",Charlottesville, United States,"Charlottesville, Virginia, United States",38.029306,-78.4766781,5472.587,33499.889,2,0
"Heidelberg,  Germany",Heidelberg, Germany,"Heidelberg, Baden-Württemberg, Germany",49.4093582,8.694724,5817.619,31225.143,9,0
"Paris,  France",Paris, France,"Paris, Ile-de-France, Metropolitan France, France",48.8566969,2.3514616,6108.682,33090.475,8,0
"Nagoya,  Japan",Nagoya, Japan,"Nagoya, Aichi Prefecture, Japan",35.1851045,136.8998438,6168.429,37812.726,2,0
"Taipei,  Taiwan",Taipei, Taiwan,"Taipei, Taiwan",25.0375198,121.5636796,8868.609,54338.841,3,0
"Osaka Prefecture,  Japan",Osaka Prefecture, Japan,"Osaka Prefecture, Japan",34.6198813,135.490357,9203.295,56413.232,3,0
"Canberra,  Australia",Canberra, Australia,"Canberra, District of Canberra Central, Australian Capital Territory, 2601, Australia",-35.2975906,149.1012676,9922.417,61080.015,2,0
"Princeton,  United States",Princeton, United States,"Princeton, Mercer County, New Jersey, United States",40.3492744,-74.6592958,10406.285,63659.731,4,0
