"location","city","country","address","latitude","longitude","co2_kg","distance_km","plane trips_amount","train trips_amount"
"Southampton,  United Kingdom","Southampton"," United Kingdom","Southampton, South East England, England, United Kingdom","50.9025349","-1.404189","0.0","0.0","0","9"
"Oxford,  United Kingdom","Oxford"," United Kingdom","Oxford, Oxfordshire, South East England, England, United Kingdom","51.7520131","-1.2578499","5.681","190.007","0","1"
"Sheffield,  United Kingdom","Sheffield"," United Kingdom","Sheffield, Yorkshire and the Humber, England, United Kingdom","53.3806626","-1.4702278","16.48","551.185","0","1"
"London,  United Kingdom","London"," United Kingdom","London, Greater London, England, United Kingdom","51.5073219","-0.1276474","20.002","668.969","0","3"
"Cambridge,  United Kingdom","Cambridge"," United Kingdom","Cambridge, Cambridgeshire, East of England, England, United Kingdom","52.197584649999996","0.13915373736874398","117.894","3942.944","0","11"
"Tübingen,  Germany","Tübingen"," Germany","Tübingen, Landkreis Tübingen, Baden-Württemberg, Germany","48.5236164","9.0535531","366.534","1592.505","1","0"
"Toulouse,  France","Toulouse"," France","Toulouse, Haute-Garonne, Occitania, Metropolitan France, France","43.6044622","1.4442469","382.989","1678.665","1","0"
"Bamberg,  Germany","Bamberg"," Germany","Bamberg, Bavaria, Germany","49.8916044","10.8868478","397.53","1754.799","1","0"
"County Durham,  United Kingdom","County Durham"," United Kingdom","County Durham, North East England, England, United Kingdom","54.666667","-1.75","446.302","1676.789","2","0"
"Leiden,  Netherlands","Leiden"," Netherlands","Leiden, Zoeterwoude, South Holland, Netherlands","52.1518157","4.4811088666204295","454.626","1720.156","2","0"
"Noordwijk,  Netherlands","Noordwijk"," Netherlands","Noordwijk, South Holland, Netherlands","52.2410856","4.4461969","455.135","1722.812","2","0"
"Prague,  Czechia","Prague"," Czechia","Prague, Czechia","50.0596288","14.446459273258009","465.969","2246.549","1","0"
"Bologna,  Italy","Bologna"," Italy","Bologna, Emilia-Romagna, Italy","44.4937577","11.3430308","481.055","2376.106","1","0"
"Tartu,  Estonia","Tartu"," Estonia","Tartu, Tartu linn, Tartu maakond, Estonia","58.3801207","26.72245","729.991","3945.135","1","0"
"Kyiv,  Ukraine","Kyiv"," Ukraine","Kyiv, Ukraine","50.4500336","30.5241361","821.433","4465.5","1","0"
"Haifa,  Israel","Haifa"," Israel","Haifa, Haifa Subdistrict, Haifa District, Israel","32.8191218","34.9983856","1226.668","7137.123","1","0"
"Madrid,  Spain","Madrid"," Spain","Madrid, Área metropolitana de Madrid y Corredor del Henares, Community of Madrid, 28001, Spain","40.4167047","-3.7035825","1916.187","9435.437","4","0"
"Harrisonburg,  United States","Harrisonburg"," United States","Harrisonburg, Rockingham County, Virginia, United States","38.4493315","-78.8688833","1966.33","11977.699","1","0"
"Rome,  Italy","Rome"," Italy","Rome, Roma Capitale, Lazio, Italy","41.8933203","12.4829321","2196.046","11660.978","4","0"
"Edmonton,  Canada","Edmonton"," Canada","Edmonton, Edmonton (city), Alberta, Canada","53.535411","-113.507996","2226.566","13590.643","1","0"
"Beijing,  China","Beijing"," China","Beijing, Dongcheng District, Beijing, 100010, China","39.906217","116.3912757","2696.162","16501.211","1","0"
"Irvine,  United States","Irvine"," United States","Irvine, Orange County, California, United States","33.6856969","-117.8259819","2855.571","17489.226","1","0"
"Kyoto,  Japan","Kyoto"," Japan","Kyoto, Kyoto Prefecture, Japan","35.021041","135.7556075","6251.85","38329.776","2","0"
"Washington,  United States","Washington"," United States","Washington, District of Columbia, United States","38.8950368","-77.0365427","7666.892","46680.923","4","0"
"Pasadena,  United States","Pasadena"," United States","Pasadena, California, United States","34.1476452","-118.1444779","8542.418","52317.105","3","0"
"Cambridge,  United States","Cambridge"," United States","Cambridge, Middlesex County, Massachusetts, United States","42.3750997","-71.1056157","13701.376","83244.154","8","0"
"Tokyo,  Japan","Tokyo"," Japan","Tokyo, Japan","35.6828387","139.7594549","18916.216","115985.128","6","0"