"location","city","country","address","latitude","longitude","co2_kg","distance_km","plane trips_amount","train trips_amount"
"Geneva,  Switzerland","Geneva"," Switzerland","Geneva, Grand Genève, Geneva, Switzerland","46.2017559","6.1466014","0.0","0.0","0","12"
"Turin,  Italy","Turin"," Italy","Turin, Torino, Piemont, Italy","45.0677551","7.6824892","10.385","347.321","0","1"
"Basel,  Switzerland","Basel"," Switzerland","Basel, Basel-City, Switzerland","47.5581077","7.5878261","11.146","372.789","0","1"
"Strasbourg,  France","Strasbourg"," France","Strasbourg, Bas-Rhin, Grand Est, Metropolitan France, France","48.584614","7.7507127","17.411","582.324","0","1"
"Nice,  France","Nice"," France","Nice, Maritime Alps, Provence-Alpes-Côte d'Azur, Metropolitan France, France","43.7009358","7.2683912","17.446","583.492","0","1"
"Lausanne,  Switzerland","Lausanne"," Switzerland","Lausanne, District de Lausanne, Vaud, Switzerland","46.5218269","6.6327025","18.498","618.675","0","6"
"Paris,  France","Paris"," France","Paris, Ile-de-France, Metropolitan France, France","48.8566969","2.3514616","24.53","820.393","0","1"
"Florence,  Italy","Florence"," Italy","Florence, Metropolitan City of Florence, Tuscany, Italy","43.7698712","11.2555757","28.953","968.334","0","1"
"Triest,  Italy","Triest"," Italy","Triest, UTI Giuliana / Julijska MTU, Friuli-Venezia Giulia, Italy","45.6504806","13.7931263","35.543","1188.718","0","1"
"Heidelberg,  Germany","Heidelberg"," Germany","Heidelberg, Baden-Württemberg, Germany","49.4093582","8.694724","120.857","4042.049","0","5"
"Hatfield,  United Kingdom","Hatfield"," United Kingdom","Hatfield, Welwyn Hatfield, Hertfordshire, East of England, England, United Kingdom","51.7634675","-0.2258741","357.707","1546.288","1","0"
"Cambridge,  United Kingdom","Cambridge"," United Kingdom","Cambridge, Cambridgeshire, East of England, England, United Kingdom","52.197584649999996","0.13915373736874398","366.54","1592.538","1","0"
"Leicester,  United Kingdom","Leicester"," United Kingdom","Leicester, Leicestershire, East Midlands, England, LE1 5YA, United Kingdom","52.6361398","-1.1330789","401.351","1774.804","1","0"
"Keele,  United Kingdom","Keele"," United Kingdom","Keele, Newcastle-under-Lyme, Staffordshire, West Midlands, England, United Kingdom","53.0038078","-2.2877425","430.033","1937.922","1","0"
"Copenhagen,  Denmark","Copenhagen"," Denmark","Copenhagen, Copenhagen Municipality, Capital Region of Denmark, 1357, Denmark","55.6867243","12.5700724","471.147","2291.013","1","0"
"Dublin,  Ireland","Dublin"," Ireland","Dublin, Dublin 1, Leinster, Ireland","53.3497645","-6.2602732","481.724","2381.852","1","0"
"Vilnius,  Lithuania","Vilnius"," Lithuania","Vilnius, Vilnius city municipality, Vilnius County, Lithuania","54.6870458","25.2829111","614.03","3285.244","1","0"
"San Cristóbal de La Laguna,  Spain","San Cristóbal de La Laguna"," Spain","San Cristóbal de La Laguna, Santa Cruz de Tenerife, Canary Islands, Spain","28.4857715","-16.3159422","1015.206","5556.299","1","0"
"Potsdam,  Germany","Potsdam"," Germany","Potsdam, Brandenburg, Germany","52.4009309","13.0591397","1162.85","5108.679","3","0"
"Accra,  Ghana","Accra"," Ghana","Accra, Korle-Klottey Municipal District, Greater Accra Region, Ghana","5.5571096","-0.2012376","1505.47","9121.28","1","0"
"Ankara,  Turkey","Ankara"," Turkey","Ankara, Çankaya, Ankara, Central Anatolia Region, 06420, Turkey","39.9207893","32.8540412","1666.82","9067.313","2","0"
"Cambridge,  United States","Cambridge"," United States","Cambridge, Middlesex County, Massachusetts, United States","42.3750997","-71.1056157","1942.0","11826.897","1","0"
"Chandigarh,  India","Chandigarh"," India","Chandigarh, 160018, India","30.7334421","76.7797143","2025.862","12346.676","1","0"
"Mumbai,  India","Mumbai"," India","Mumbai, Mumbai Suburban, Maharashtra, India","19.0759899","72.8773928","2200.176","13427.075","1","0"
"Urbana,  United States","Urbana"," United States","Urbana, Champaign County, Illinois, United States","40.1117174","-88.207301","2361.028","14424.043","1","0"
"Atlanta,  United States","Atlanta"," United States","Atlanta, Fulton County, Georgia, United States","33.7489924","-84.3902644","2426.962","14832.703","1","0"
"Bengaluru,  India","Bengaluru"," India","Bengaluru, Bangalore North, Bangalore Urban, Karnataka, India","12.9791198","77.5912997","2469.016","15093.351","1","0"
"Pabna,  Bangladesh","Pabna"," Bangladesh","Pabna, Pabna district, Rajshahi Division, 6600, Bangladesh","24.005","89.25","2484.917","15191.907","1","0"
"Kolkata,  India","Kolkata"," India","Kolkata, West Bengal, India","22.5726723","88.3638815","2498.061","15273.376","1","0"
"Austin,  United States","Austin"," United States","Austin, Travis County, Texas, United States","30.2711286","-97.7436995","2806.361","17184.225","1","0"
"Seoul,  South Korea","Seoul"," South Korea","Seoul, Nowon-gu, South Korea","37.5666791","126.9782914","2935.066","17981.938","1","0"
"Shanghai,  China","Shanghai"," China","Shanghai, Huangpu District, Shanghai, 200001, China","31.2322758","121.4692071","3013.483","18467.968","1","0"
"Fukuoka Prefecture,  Japan","Fukuoka Prefecture"," Japan","Fukuoka Prefecture, Japan","33.6251241","130.6180016","3111.862","19077.726","1","0"
"Kobe,  Japan","Kobe"," Japan","Kobe, Hyogo Prefecture, Japan","34.6932379","135.1943764","3155.473","19348.026","1","0"
"Perth,  Australia","Perth"," Australia","Perth, City of Perth, Western Australia, 6000, Australia","-31.9527121","115.8604796","4535.288","27900.143","1","0"
"Beijing,  China","Beijing"," China","Beijing, Dongcheng District, Beijing, 100010, China","39.906217","116.3912757","5362.209","32815.76","2","0"
"Melbourne,  Australia","Melbourne"," Australia","Melbourne, City of Melbourne, Victoria, Australia","-37.8142176","144.9631608","5367.629","33059.009","1","0"
"Victoria,  Canada","Victoria"," Canada","Victoria, Capital Regional District, British Columbia, Canada","48.4283182","-123.3649533","5496.673","33649.175","2","0"
"Tokyo,  Japan","Tokyo"," Japan","Tokyo, Japan","35.6828387","139.7594549","6389.545","39183.207","2","0"
"São Paulo,  Brazil","São Paulo"," Brazil","São Paulo, Região Imediata de São Paulo, Região Metropolitana de São Paulo, Região Geográfica Intermediária de São Paulo, São Paulo, Southeast Region, Brazil","-23.5506507","-46.6333824","9200.139","56393.669","3","0"
"University of Notre Dame du Lac,  United States","University of Notre Dame du Lac"," United States","University of Notre Dame du Lac, Warrick Street, Maple Lane, Saint Joseph County, Indiana, 46556, United States","41.704567749999995","-86.23822026017265","13700.737","83659.498","6","0"
"Canberra,  Australia","Canberra"," Australia","Canberra, District of Canberra Central, Australian Capital Territory, 2601, Australia","-35.2975906","149.1012676","21695.218","133628.739","4","0"