"location","city","country","address","latitude","longitude","co2_kg","distance_km","plane trips_amount","train trips_amount"
"Beijing,  China","Beijing"," China","Beijing, Dongcheng District, Beijing, 100010, China","39.906217","116.3912757","0.0","0.0","0","41"
"Nanjing,  China","Nanjing"," China","Nanjing, Nanjing City, Jiangsu, 210008, China","32.0609736","118.7916458","107.471","3594.34","0","2"
"Taipei,  Taiwan","Taipei"," Taiwan","Taipei, Taiwan","25.0375198","121.5636796","641.996","3444.385","1","0"
"Nur-Sultan,  Kazakhstan","Nur-Sultan"," Kazakhstan","Nur-Sultan, Kazakhstan","51.1282205","71.4306682","1239.365","7305.091","1","0"
"Pune,  India","Pune"," India","Pune, Pune District, Maharashtra, India","18.521428","73.8544541","1551.248","9405.008","1","0"
"Tel Aviv-Yafo,  Israel","Tel Aviv-Yafo"," Israel","Tel Aviv-Yafo, Tel Aviv Subdistrict, Tel Aviv District, Israel","32.0852997","34.7818064","2336.517","14272.122","1","0"
"Vienna,  Austria","Vienna"," Austria","Vienna, Austria","48.2083537","16.3725042","2440.873","14918.922","1","0"
"Crawley,  Australia","Crawley"," Australia","Crawley, City of Perth, Western Australia, Australia","-31.9786452","115.8172143","2613.187","15986.924","1","0"
"Oxford,  United Kingdom","Oxford"," United Kingdom","Oxford, Oxfordshire, South East England, England, United Kingdom","51.7520131","-1.2578499","2672.284","16353.211","1","0"
"Marseille,  France","Marseille"," France","Marseille, Bouches-du-Rhône, Provence-Alpes-Côte d'Azur, Metropolitan France, 13000, France","43.2961743","5.3699525","2765.539","16931.206","1","0"
"Sydney,  Australia","Sydney"," Australia","Sydney, New South Wales, Australia","-33.8548157","151.2164539","2921.187","17895.918","1","0"
"Canberra,  Australia","Canberra"," Australia","Canberra, District of Canberra Central, Australian Capital Territory, 2601, Australia","-35.2975906","149.1012676","2940.878","18017.963","1","0"
"Melbourne,  Australia","Melbourne"," Australia","Melbourne, City of Melbourne, Victoria, Australia","-37.8142176","144.9631608","2976.662","18239.753","1","0"
"Santa Cruz County,  United States","Santa Cruz County"," United States","Santa Cruz County, California, United States","37.050096","-121.9905908","3128.207","19179.031","1","0"
"Los Angeles,  United States","Los Angeles"," United States","Los Angeles, California, United States","34.0536909","-118.242766","3280.813","20124.885","1","0"
"San Diego,  United States","San Diego"," United States","San Diego, San Diego County, California, United States","32.7174202","-117.1627728","3338.484","20482.329","1","0"
"Toronto,  Canada","Toronto"," Canada","Toronto, Golden Horseshoe, Ontario, Canada","43.6534817","-79.3839347","3450.986","21179.619","1","0"
"Storrs,  United States","Storrs"," United States","Storrs, Mansfield, Tolland County, Connecticut, United States","41.80564555","-72.25413294148728","3546.997","21774.695","1","0"
"Baltimore,  United States","Baltimore"," United States","Baltimore, Maryland, United States","39.2908816","-76.610759","3618.909","22220.413","1","0"
"Mexico City,  Mexico","Mexico City"," Mexico","Mexico City, Mexico","19.4326296","-99.1331785","4054.046","24917.398","1","0"
"Shanghai,  China","Shanghai"," China","Shanghai, Huangpu District, Shanghai, 200001, China","31.2322758","121.4692071","8154.785","38439.747","18","0"
"Garching bei München,  Germany","Garching bei München"," Germany","Garching bei München, Landkreis München, Bavaria, 85748, Germany","48.2513878","11.6509662","10123.687","61908.184","4","0"
"Cambridge,  United Kingdom","Cambridge"," United Kingdom","Cambridge, Cambridgeshire, East of England, England, United Kingdom","52.197584649999996","0.13915373736874398","10556.133","64588.49","4","0"
"Groningen,  Netherlands","Groningen"," Netherlands","Groningen, Netherlands","53.2190652","6.5680077","15061.64","92094.402","6","0"
"Heidelberg,  Germany","Heidelberg"," Germany","Heidelberg, Baden-Württemberg, Germany","49.4093582","8.694724","17918.917","109594.203","7","0"