"location","city","country","address","latitude","longitude","co2_kg","distance_km","plane trips_amount","train trips_amount"
"London,  United Kingdom","London"," United Kingdom","London, Greater London, England, United Kingdom","51.5073219","-0.1276474","0.0","0.0","0","5"
"Cambridge,  United Kingdom","Cambridge"," United Kingdom","Cambridge, Cambridgeshire, East of England, England, United Kingdom","52.197584649999996","0.13915373736874398","18.875","631.287","0","4"
"Oxford,  United Kingdom","Oxford"," United Kingdom","Oxford, Oxfordshire, South East England, England, United Kingdom","51.7520131","-1.2578499","19.762","660.945","0","4"
"Southampton,  United Kingdom","Southampton"," United Kingdom","Southampton, South East England, England, United Kingdom","50.9025349","-1.404189","26.67","891.958","0","4"
"Sheffield,  United Kingdom","Sheffield"," United Kingdom","Sheffield, Yorkshire and the Humber, England, United Kingdom","53.3806626","-1.4702278","54.371","1818.433","0","4"
"Liverpool,  United Kingdom","Liverpool"," United Kingdom","Liverpool, North West England, England, United Kingdom","53.4071991","-2.99168","68.606","2294.512","0","4"
"County Durham,  United Kingdom","County Durham"," United Kingdom","County Durham, North East England, England, United Kingdom","54.666667","-1.75","813.39","2940.847","4","0"
"City of Edinburgh,  United Kingdom","City of Edinburgh"," United Kingdom","City of Edinburgh, Scotland, United Kingdom","55.9533456","-3.1883749","1064.932","4269.371","4","0"
"San Cristóbal de La Laguna,  Spain","San Cristóbal de La Laguna"," Spain","San Cristóbal de La Laguna, Santa Cruz de Tenerife, Canary Islands, Spain","28.4857715","-16.3159422","2112.066","11571.663","2","0"
"Prague,  Czechia","Prague"," Czechia","Prague, Czechia","50.0596288","14.446459273258009","2227.512","10353.88","5","0"