"location","city","country","address","latitude","longitude","co2_kg","distance_km","plane trips_amount","train trips_amount"
"Tokyo,  Japan","Tokyo"," Japan","Tokyo, Japan","35.6828387","139.7594549","0.0","0.0","0","16"
"Achi,  Japan","Achi"," Japan","Achi, Shimoina District, Nagano Prefecture, Japan","35.4441022","137.747532","10.998","367.818","0","1"
"Hyōgo,  Japan","Hyōgo"," Japan","Hyōgo, National Highway Route 2, Matsubaradori 5-chome, Hyogo Ward, Kobe, Hyogo Prefecture, 652ー0809, Japan","34.6678618","135.1641163","25.87","865.202","0","1"
"Wakayama,  Japan","Wakayama"," Japan","Wakayama, Wakayama Prefecture, 640-8511, Japan","34.234617","135.1782181","26.755","894.833","0","1"
"Kyoto,  Japan","Kyoto"," Japan","Kyoto, Kyoto Prefecture, Japan","35.021041","135.7556075","44.308","1481.881","0","2"
"Sapporo,  Japan","Sapporo"," Japan","Sapporo, Ishikari Subprefecture, Hokkaido Prefecture, Japan","43.061936","141.3542924","380.129","1663.69","1","0"
"Kyushu,  Japan","Kyushu"," Japan","Kyushu, Japan","32.4820755","131.10090516153372","395.77","1745.582","1","0"
"Bundang-gu,  South Korea","Bundang-gu"," South Korea","Bundang-gu, Seongnam-si, Gyeonggi-do, South Korea","37.3825999","127.1188","470.843","2288.402","1","0"
"Busan,  South Korea","Busan"," South Korea","Busan, South Korea","35.1799528","129.0752365","860.156","3876.622","2","0"
"Daejeon,  South Korea","Daejeon"," South Korea","Daejeon, South Korea","36.3496","127.3848","927.936","4458.724","2","0"
"Hong Kong Island,  China","Hong Kong Island"," China","Hong Kong Island, Hong Kong, China","22.2793278","114.1628131","1054.333","5776.27","1","0"
"Mandaluyong,  Philippines","Mandaluyong"," Philippines","Mandaluyong, Eastern Manila District, Metro Manila, Philippines","14.5776485","121.0337001","1093.423","5996.038","1","0"
"Bangkok,  Thailand","Bangkok"," Thailand","Bangkok, Phra Borom Maha Ratchawang Subdistrict, Phra Nakhon District, Bangkok, 10200, Thailand","13.7544238","100.4930399","1521.155","9218.496","1","0"
"Beijing,  China","Beijing"," China","Beijing, Dongcheng District, Beijing, 100010, China","39.906217","116.3912757","1549.411","8399.18","2","0"
"Kuala Lumpur,  Malaysia","Kuala Lumpur"," Malaysia","Kuala Lumpur, Malaysia","3.1516964","101.6942371","1752.036","10649.495","1","0"
"Petaling Jaya,  Malaysia","Petaling Jaya"," Malaysia","Petaling Jaya, Petaling, Selangor, Malaysia","3.0991752","101.6450232","1754.616","10665.49","1","0"
"Nilai,  Malaysia","Nilai"," Malaysia","Nilai, Jalan Terminal Nilai, Kampung Momo, Nilai, Seremban, Negeri Sembilan, 71800, Malaysia","2.8022628","101.7995057","1758.766","10691.209","1","0"
"Dahlan,  Indonesia","Dahlan"," Indonesia","Dahlan, 85, Jalan Ekonomi, Dsn. Tolo Nggeru, West Nusa Tenggara, Indonesia","-8.48181725","118.54905185689495","1773.228","10780.846","1","0"
"New Delhi,  India","New Delhi"," India","New Delhi, Delhi, India","28.6138954","77.2090057","1919.442","11687.081","1","0"
"Hawaii,  United States","Hawaii"," United States","Hawaii, United States","19.58726775","-155.42688965312746","2135.96","13029.064","1","0"
"Pune,  India","Pune"," India","Pune, Pune District, Maharashtra, India","18.521428","73.8544541","2187.342","13347.535","1","0"
"Manila,  Philippines","Manila"," Philippines","Manila, Capital District, Metro Manila, Philippines","14.5907332","120.9809674","2188.324","12000.386","2","0"
"Stockholm,  Sweden","Stockholm"," Sweden","Stockholm, Stockholms kommun, Stockholm County, 111 29, Sweden","59.3251172","18.0710935","2671.093","16345.83","1","0"
"San Jose,  United States","San Jose"," United States","San Jose, Santa Clara County, California, 95113, United States","37.3361905","-121.890583","2722.419","16663.95","1","0"
"Johannisburg,  Germany","Johannisburg"," Germany","Johannisburg, Bülow, Königsfeld, Rehna, Nordwestmecklenburg, Mecklenburg-Vorpommern, 19217, Germany","53.7822114","11.0370071","2911.128","17833.574","1","0"
"National Library of the Czech Republic,  Czechia","National Library of the Czech Republic"," Czechia","National Library of the Czech Republic, 190, Révové nádvoří, Old Town, Prague, 11000, Czechia","50.0864234","14.4156772","2962.063","18149.266","1","0"
"Tempe,  United States","Tempe"," United States","Tempe, Maricopa County, Arizona, United States","33.4255056","-111.9400091","3039.719","18630.578","1","0"
"St. Cloud,  United States","St. Cloud"," United States","St. Cloud, Stearns County, Minnesota, United States","45.5616075","-94.1642004","3095.175","18974.299","1","0"
"Tirana,  Albania","Tirana"," Albania","Tirana, Tirana Municipally, Tirana County, Central Albania, 1001-1028, Albania","41.3279485","19.8185512","3096.9","18984.988","1","0"
"River Falls,  United States","River Falls"," United States","River Falls, Pierce County, Wisconsin, 54022, United States","44.8595111","-92.6265897","3139.611","19249.712","1","0"
"Geneva,  Switzerland","Geneva"," Switzerland","Geneva, Grand Genève, Geneva, Switzerland","46.2017559","6.1466014","3194.772","19591.604","1","0"
"Indianapolis,  United States","Indianapolis"," United States","Indianapolis, Marion, Indiana, United States","39.7683331","-86.1583502","3389.027","20795.597","1","0"
"Barcelona,  Spain","Barcelona"," Spain","Barcelona, Barcelonès, Barcelona, Catalonia, 08001, Spain","41.3828939","2.1774322","3395.398","20835.084","1","0"
"Columbus,  United States","Columbus"," United States","Columbus, Franklin, Ohio, United States","39.9622601","-83.0007065","3432.797","21066.885","1","0"
"Valencia,  Spain","Valencia"," Spain","Valencia, Comarca de València, Valencia, Valencian Community, Spain","39.4697065","-0.3763353","3490.741","21426.025","1","0"
"Scranton,  United States","Scranton"," United States","Scranton, Lackawanna County, Pennsylvania, United States","41.4086874","-75.6621294","3491.018","21427.742","1","0"
"Cambridge,  United States","Cambridge"," United States","Cambridge, Middlesex County, Massachusetts, United States","42.3750997","-71.1056157","3514.418","21572.772","1","0"
"New York,  United States","New York"," United States","New York, United States","40.7127281","-74.0060152","3533.945","21693.804","1","0"
"Lisbon,  Portugal","Lisbon"," Portugal","Lisbon, Grande Lisboa, Área Metropolitana de Lisboa, Portugal","38.7077507","-9.1365919","3630.898","22294.716","1","0"
"Mexico City,  Mexico","Mexico City"," Mexico","Mexico City, Mexico","19.4326296","-99.1331785","3680.583","22602.67","1","0"
"Jakarta Special Capital Region,  Indonesia","Jakarta Special Capital Region"," Indonesia","Jakarta Special Capital Region, Indonesia","-6.1753942","106.827183","3802.518","23148.772","2","0"
"Kitwe,  Zambia","Kitwe"," Zambia","Kitwe, Kitwe District, Copperbelt Province, 1001, Zambia","-12.8104186","28.2068361","4154.852","25542.192","1","0"
"Nsukka,  Nigeria","Nsukka"," Nigeria","Nsukka, Enugu, 410001, Nigeria","6.8561","7.3927","4277.889","26304.783","1","0"
"Pretoria,  South Africa","Pretoria"," South Africa","Pretoria, City of Tshwane Metropolitan Municipality, Gauteng, 0126, South Africa","-25.7459374","28.1879444","4393.026","27018.402","1","0"
"Khayelitsha,  South Africa","Khayelitsha"," South Africa","Khayelitsha, City of Cape Town, Western Cape, 7784, South Africa","-34.0405905","18.6674201","4783.893","29440.999","1","0"
"Antofagasta,  Chile","Antofagasta"," Chile","Antofagasta, Provincia de Antofagasta, Antofagasta Region, Chile","-23.6463741","-70.3980033","5463.28","33651.852","1","0"
"Diego Portales,  Chile","Diego Portales"," Chile","Diego Portales, Punta Arenas, Provincia de Magallanes, Region of Magallanes and Chilean Antarctica, AV. CIRCUNVALACIÓN, Chile","-53.1638982","-70.943428","5499.197","33874.47","1","0"
"Santiago,  Chile","Santiago"," Chile","Santiago, Provincia de Santiago, Santiago Metropolitan Region, Chile","-33.4377756","-70.6504502","5593.777","34460.677","1","0"
"Autonomous City of Buenos Aires,  Argentina","Autonomous City of Buenos Aires"," Argentina","Autonomous City of Buenos Aires, Comuna 6, Autonomous City of Buenos Aires, Argentina","-34.6075682","-58.4370894","5957.873","36717.351","1","0"
"Vienna,  Austria","Vienna"," Austria","Vienna, Austria","48.2083537","16.3725042","5961.073","36527.53","2","0"
"Rio de Janeiro,  Brazil","Rio de Janeiro"," Brazil","Rio de Janeiro, Região Geográfica Imediata do Rio de Janeiro, Região Metropolitana do Rio de Janeiro, Região Geográfica Intermediária do Rio de Janeiro, Rio de Janeiro, Southeast Region, Brazil","-22.9110137","-43.2093727","6024.869","37132.592","1","0"
"Porto Alegre,  Brazil","Porto Alegre"," Brazil","Porto Alegre, Região Geográfica Imediata de Porto Alegre, Metropolitan Region of Porto Alegre, Região Geográfica Intermediária de Porto Alegre, Rio Grande do Sul, South Region, Brazil","-30.0324999","-51.2303767","6104.405","37625.559","1","0"
"Garching bei München,  Germany","Garching bei München"," Germany","Garching bei München, Landkreis München, Bavaria, 85748, Germany","48.2513878","11.6509662","6108.59","37441.847","2","0"
"Jodrell Bank,  United Kingdom","Jodrell Bank"," United Kingdom","Jodrell Bank, Lower Withington, Cheshire East, North West England, England, SK11 9DW, United Kingdom","53.2434155","-2.2990958","6180.434","37887.136","2","0"
"London,  United Kingdom","London"," United Kingdom","London, Greater London, England, United Kingdom","51.5073219","-0.1276474","6238.572","38247.476","2","0"
"Portsmouth,  United Kingdom","Portsmouth"," United Kingdom","Portsmouth, South East England, England, United Kingdom","50.8036831","-1.075614","6303.879","38652.248","2","0"
"Hilo,  United States","Hilo"," United States","Hilo, Hawaiʻi County, Hawaii, United States","19.7073734","-155.0815803","6431.471","39233.417","3","0"
"Baltimore,  United States","Baltimore"," United States","Baltimore, Maryland, United States","39.2908816","-76.610759","7090.465","43527.525","2","0"
"Washington,  United States","Washington"," United States","Washington, District of Columbia, United States","38.8949924","-77.0365581","7103.657","43609.291","2","0"
"Granada,  Spain","Granada"," Spain","Granada, Comarca de la Vega de Granada, Granada, Andalusia, Spain","37.183054","-3.6021928","7215.029","44299.572","2","0"
"Melbourne,  Australia","Melbourne"," Australia","Melbourne, City of Melbourne, Victoria, Australia","-37.8142176","144.9631608","8029.893","49140.465","3","0"
"Leiden,  Netherlands","Leiden"," Netherlands","Leiden, Zoeterwoude, South Holland, Netherlands","52.1518157","4.4811088666204295","9131.346","55967.289","3","0"
"Paris,  France","Paris"," France","Paris, Ile-de-France, Metropolitan France, France","48.8566969","2.3514616","9506.579","58292.988","3","0"
"Rome,  Italy","Rome"," Italy","Rome, Roma Capitale, Lazio, Italy","41.8933203","12.4829321","9645.659","59155.011","3","0"
"Chiang Mai,  Thailand","Chiang Mai"," Thailand","Chiang Mai, Saraphi District, Chiang Mai Province, 4452, Thailand","18.7882778","98.9868056","10189.668","61688.178","7","0"
"Concepcion,  Chile","Concepcion"," Chile","Concepcion, Provincia de Concepción, Biobío Region, Chile","-36.8270795","-73.0502399","11093.677","68339.502","2","0"
"Cape Town,  South Africa","Cape Town"," South Africa","Cape Town, City of Cape Town, Western Cape, 8001, South Africa","-33.928992","18.417396","14368.647","88428.174","3","0"
"Toronto,  Canada","Toronto"," Canada","Toronto, Golden Horseshoe, Ontario, Canada","43.6534817","-79.3839347","20234.491","124155.826","6","0"