"location","city","country","address","latitude","longitude","co2_kg","distance_km","plane trips_amount","train trips_amount"
"Catania,  Italy","Catania"," Italy","Catania, Sicily, Italy","37.5022355","15.08738","0.0","0.0","0","5"
"Belgrade,  Serbia","Belgrade"," Serbia","Belgrade, Stari Grad Urban Municipality, City of Belgrade, Central Serbia, 11000, Serbia","44.8178131","20.4568974","417.192","1857.746","1","0"
"Budapest,  Hungary","Budapest"," Hungary","Budapest, V. kerület, Central Hungary, Hungary","47.4983815","19.0404707","473.914","2314.779","1","0"
"Bratislava,  Slovakia","Bratislava"," Slovakia","Bratislava, Region of Bratislava, Slovakia","48.1516988","17.1093063","482.783","2390.95","1","0"
"Geneva,  Switzerland","Geneva"," Switzerland","Geneva, Grand Genève, Geneva, Switzerland","46.2017559","6.1466014","487.696","2433.143","1","0"
"Istanbul,  Turkey","Istanbul"," Turkey","Istanbul, Fatih, Istanbul, Marmara Region, 34126, Turkey","41.0096334","28.9651646","496.712","2510.569","1","0"
"Krakow,  Poland","Krakow"," Poland","Krakow, Wieliczka County, Lesser Poland Voivodeship, Poland","50.0469432","19.997153435836697","545.883","2897.44","1","0"
"Jena,  Germany","Jena"," Germany","Jena, Thuringia, Germany","50.9281717","11.5879359","570.326","3036.539","1","0"
"Wrocław,  Poland","Wrocław"," Poland","Wrocław, Trzebnica County, Lower Silesian Voivodeship, Poland","51.1263106","16.97819633051261","571.724","3044.491","1","0"
"Brussels,  Belgium","Brussels"," Belgium","Brussels, City of Brussels, Brussels-Capital, Belgium","50.8465573","4.351697","637.392","3418.19","1","0"
"Toruń,  Poland","Toruń"," Poland","Toruń, Toruń County, Kuyavian-Pomeranian Voivodeship, Poland","53.0145361","18.596583144651557","650.392","3492.166","1","0"
"Leiden,  Netherlands","Leiden"," Netherlands","Leiden, Zoeterwoude, South Holland, Netherlands","52.1518157","4.4811088666204295","678.741","3653.492","1","0"
"Tel Aviv-Yafo,  Israel","Tel Aviv-Yafo"," Israel","Tel Aviv-Yafo, Tel Aviv Subdistrict, Tel Aviv District, Israel","32.0852997","34.7818064","701.768","3784.531","1","0"
"London,  United Kingdom","London"," United Kingdom","London, Greater London, England, United Kingdom","51.5073219","-0.1276474","726.192","3923.518","1","0"
"Cardiff,  United Kingdom","Cardiff"," United Kingdom","Cardiff, Wales, CF, United Kingdom","51.4816546","-3.1791934","779.466","4226.679","1","0"
"Nova Gorica,  Slovenia","Nova Gorica"," Slovenia","Nova Gorica, Slovenia","45.9580549","13.6474706","848.814","3791.044","2","0"
"City of Edinburgh,  United Kingdom","City of Edinburgh"," United Kingdom","City of Edinburgh, Scotland, United Kingdom","55.9533456","-3.1883749","903.145","4926.283","1","0"
"Baku,  Azerbaijan","Baku"," Azerbaijan","Baku, Absheron, Azerbaijan","40.3754434","49.8326748","1095.068","6005.286","1","0"
"Turin,  Italy","Turin"," Italy","Turin, Torino, Piemont, Italy","45.0677551","7.6824892","1342.023","6259.704","3","0"
"Cambridge,  United Kingdom","Cambridge"," United Kingdom","Cambridge, Cambridgeshire, East of England, England, United Kingdom","52.197584649999996","0.13915373736874398","1483.564","8024.471","2","0"
"Liverpool,  United Kingdom","Liverpool"," United Kingdom","Liverpool, North West England, England, United Kingdom","53.4071991","-2.99168","1653.886","8993.711","2","0"
"Cambridge,  United States","Cambridge"," United States","Cambridge, Middlesex County, Massachusetts, United States","42.3750997","-71.1056157","2305.294","14078.604","1","0"
"Johannesburg,  South Africa","Johannesburg"," South Africa","Johannesburg, City of Johannesburg Metropolitan Municipality, Gauteng, 2001, South Africa","-26.205","28.049722","2361.084","14424.39","1","0"
"Vilnius,  Lithuania","Vilnius"," Lithuania","Vilnius, Vilnius city municipality, Vilnius County, Lithuania","54.6870458","25.2829111","3044.682","16490.274","4","0"
"Tokyo,  Japan","Tokyo"," Japan","Tokyo, Japan","35.6828387","139.7594549","3286.687","20161.29","1","0"
"Kyiv,  Ukraine","Kyiv"," Ukraine","Kyiv, Ukraine","50.4500336","30.5241361","3503.641","18893.057","5","0"
"Warsaw,  Poland","Warsaw"," Poland","Warsaw, Masovian Voivodeship, Poland","52.2319581","21.0067249","7617.009","40837.881","12","0"